{
    "$schema": "../Schemas/winGetAppTemplate.schema.json",
    "schemaVersion": "1.0.0",
    "templateId": "notion",
    "packageIdentifier": "Notion.Notion",
    "displayName": "Notion",
    "publisher": "Notion Labs Inc.",
    "description": "Mobile-apps WinGet template for Notion Win32 packaging.",
    "package": {
        "source": "WinGet",
        "match": {
            "packageIdentifier": "Notion.Notion",
            "architectures": [
                "x64"
            ],
            "installerTypes": [
                "msix"
            ],
            "scope": "user",
            "locale": "en-US",
            "channel": null
        }
    },
    "install": {
        "command": "winget install --id Notion.Notion --exact --scope user --silent --accept-package-agreements --accept-source-agreements",
        "experience": "user",
        "restartBehavior": "suppress"
    },
    "uninstall": {
        "command": "winget uninstall --id Notion.Notion --exact --scope user --silent",
        "behavior": "allow"
    },
    "detection": {
        "strategy": "generated"
    },
    "requirements": {
        "minimumSupportedWindowsRelease": "W10_22H2",
        "architectures": [
            "x64"
        ],
        "minimumFreeDiskSpaceInMB": null,
        "minimumMemoryInMB": null
    },
    "icon": {
        "sourceType": "file",
        "fileName": "../Icons/notion.png",
        "notes": "Bundled from IntuneGet public icons."
    },
    "metadata": {
        "categories": [
            "MobileApps",
            "Productivity"
        ],
        "tags": [
            "mobile-apps",
            "productivity",
            "notes"
        ],
        "notes": [],
        "placeholders": {
            "customNotes": [],
            "owner": "",
            "scopeTagIds": []
        },
        "markers": {
            "hydration": "Imported by Intune Hydration Kit",
            "source": "Imported from WinGet"
        }
    },
    "resolvedPackage": {
        "packageVersion": "latest",
        "manifestSource": {
            "repository": "microsoft/winget-pkgs",
            "ref": "master",
            "packagePath": "manifests/n/Notion/Notion",
            "versionPath": "manifests/n/Notion/Notion",
            "installerFile": null,
            "localeFile": null
        },
        "selectedInstaller": {
            "Architecture": "x64",
            "Scope": "user",
            "InstallerLocale": "en-US",
            "InstallerType": "msix",
            "InstallerUrl": null,
            "InstallerSha256": null,
            "ProductCode": null,
            "PackageFamilyName": null,
            "NestedInstallerType": null,
            "AppsAndFeaturesEntry": []
        }
    }
}
