{
    "$schema": "../Schemas/winGetAppTemplate.schema.json",
    "schemaVersion": "1.0.0",
    "templateId": "claude-code",
    "packageIdentifier": "Anthropic.ClaudeCode",
    "displayName": "Claude Code",
    "publisher": "Anthropic PBC",
    "description": "Starter-pack WinGet template for Claude Code Win32 packaging.",
    "package": {
        "source": "WinGet",
        "match": {
            "packageIdentifier": "Anthropic.ClaudeCode",
            "architectures": [
                "x64",
                "arm64"
            ],
            "installerTypes": [
                "portable"
            ],
            "scope": "machine",
            "locale": null,
            "channel": null
        }
    },
    "install": {
        "command": "winget install --id Anthropic.ClaudeCode --exact --scope machine --accept-package-agreements --accept-source-agreements",
        "experience": "system",
        "restartBehavior": "suppress"
    },
    "uninstall": {
        "command": "winget uninstall --id Anthropic.ClaudeCode --exact --scope machine --silent",
        "behavior": "allow"
    },
    "detection": {
        "strategy": "generated"
    },
    "requirements": {
        "minimumSupportedWindowsRelease": "W10_22H2",
        "architectures": [
            "x64",
            "arm64"
        ],
        "minimumFreeDiskSpaceInMB": null,
        "minimumMemoryInMB": null
    },
    "icon": {
        "sourceType": "file",
        "fileName": "../Icons/claude-code.png",
        "notes": "Bundled from IntuneGet public icons."
    },
    "metadata": {
        "categories": [
            "StarterPack",
            "AI",
            "Development"
        ],
        "tags": [
            "starter-pack",
            "ai",
            "llm",
            "cli",
            "development"
        ],
        "notes": [],
        "placeholders": {
            "customNotes": [],
            "owner": "",
            "scopeTagIds": []
        },
        "markers": {
            "hydration": "Imported by Intune Hydration Kit",
            "source": "Imported from WinGet"
        }
    },
    "resolvedPackage": {
        "packageVersion": "latest",
        "manifestSource": {
            "repository": "microsoft/winget-pkgs",
            "ref": "master",
            "packagePath": "manifests/a/Anthropic/ClaudeCode",
            "versionPath": "manifests/a/Anthropic/ClaudeCode",
            "installerFile": null,
            "localeFile": null
        },
        "selectedInstaller": {
            "Architecture": "x64",
            "Scope": "machine",
            "InstallerLocale": "",
            "InstallerType": "portable",
            "InstallerUrl": null,
            "InstallerSha256": null,
            "ProductCode": null,
            "PackageFamilyName": null,
            "NestedInstallerType": null,
            "AppsAndFeaturesEntry": []
        }
    }
}
